{
  "$schema": "https://aegaeon.dev/spec/server-assurance-contract.schema.json",
  "schema_version": 1,
  "contract_id": "aegaeon-server-assurance-v1",
  "adoption_state": "specified-not-attested",
  "contract_revision": "2026-09-07-r3",
  "evaluation_document": "docs/verification/claims/assurance-evaluation.md",
  "guarantee_ids_semantics": "minimum-cross-references",
  "normative_document": "docs/verification/claims/assurance-case/assurance-contract.md",
  "standards_document": "docs/verification/claims/assurance-case/standards-baseline.md",
  "status_document": "docs/verification/claims/assurance-case/contract-status.md",
  "source_retrieved_at": "2026-09-07",
  "profile": {
    "id": "server-foundation-v1",
    "roles": [
      "authorization-server",
      "openid-provider",
      "own-resource-server"
    ],
    "required_capabilities": [
      "authorization-code",
      "pkce-s256",
      "refresh-rotation",
      "par",
      "dpop",
      "revocation",
      "introspection",
      "oidc-code-flow",
      "discovery",
      "jwks",
      "userinfo"
    ],
    "forbidden_grants": [
      "implicit",
      "resource-owner-password"
    ],
    "dynamic_op_relationships": "requires-separate-resolved-profile"
  },
  "guarantee_ids": [
    "G-01",
    "G-02",
    "G-03",
    "G-04",
    "G-05",
    "G-06",
    "G-07",
    "G-08",
    "G-09",
    "G-10",
    "G-11",
    "G-12",
    "G-13",
    "G-14",
    "G-15",
    "G-16",
    "G-17",
    "G-18"
  ],
  "supporting_source_ids": [
    "rfc2119",
    "rfc8174",
    "rfc3986",
    "rfc4648",
    "rfc8259",
    "rfc8037",
    "rfc7638"
  ],
  "sources": [
    {
      "id": "oauth-browser-apps-27",
      "edition": "draft-ietf-oauth-browser-based-apps-27; 2026-07-06",
      "uri": "https://www.ietf.org/archive/id/draft-ietf-oauth-browser-based-apps-27.txt",
      "sha256": "ea575e8318acfff352f641b278b0d2e998d655a043e34891f7d01010cf6ea11a"
    },
    {
      "id": "oauth-form-post",
      "edition": "1.0; 2015-04-27",
      "uri": "https://openid.net/specs/oauth-v2-form-post-response-mode-1_0.html",
      "sha256": "5c776e43611a8fb03f673b121ebadab504f5372cb3c15dc020a9bd867a3a02dc"
    },
    {
      "id": "oauth21-16",
      "edition": "draft-ietf-oauth-v2-1-16; 2026-09-03",
      "uri": "https://www.ietf.org/archive/id/draft-ietf-oauth-v2-1-16.txt",
      "sha256": "c27a60f631fc0bc0e4809426ee9fc26f695ec586191215d775c12e4b8171fa12"
    },
    {
      "id": "oidc-back-logout",
      "edition": "1.0 incorporating errata set 1; 2023-12-15",
      "uri": "https://openid.net/specs/openid-connect-backchannel-1_0-errata1.html",
      "sha256": "3b5c933d5269047b39a65166d5c4d8ff6852b06451f54ed2531b8f97299fdc50"
    },
    {
      "id": "oidc-core",
      "edition": "1.0 incorporating errata set 2; 2023-12-15",
      "uri": "https://openid.net/specs/openid-connect-core-1_0-errata2.html",
      "sha256": "4d016752a645e8a3c259baa4173b5a90cb6c82898ce868fc8444adde262a5aed"
    },
    {
      "id": "oidc-discovery",
      "edition": "1.0 incorporating errata set 2; 2023-12-15",
      "uri": "https://openid.net/specs/openid-connect-discovery-1_0-errata2.html",
      "sha256": "0401a07b35de50e914e195aa2c3c64cc4f6542464381c885d24a2623fbf75ec2"
    },
    {
      "id": "oidc-front-logout",
      "edition": "1.0; 2022-09-12",
      "uri": "https://openid.net/specs/openid-connect-frontchannel-1_0.html",
      "sha256": "8b89f9f5a9386474b424a20dd24994763137d14d5f13915a9dd4e6cb71f9061b"
    },
    {
      "id": "oidc-registration",
      "edition": "1.0 incorporating errata set 2; 2023-12-15",
      "uri": "https://openid.net/specs/openid-connect-registration-1_0-errata2.html",
      "sha256": "c151a4abab7704f2efa9b00530dcfeeefb3de6acbdbdf5ba05c9903f1de2a318"
    },
    {
      "id": "oidc-rp-logout",
      "edition": "1.0; 2022-09-12",
      "uri": "https://openid.net/specs/openid-connect-rpinitiated-1_0.html",
      "sha256": "246432dafaa5556d896fa9b9ae4284b213ff6921b33478ed3b46bd6bd4aab804"
    },
    {
      "id": "openid-federation",
      "edition": "1.0; 2026-02-17",
      "uri": "https://openid.net/specs/openid-federation-1_0.html",
      "sha256": "4a71afdfbed5755d6704d6a089f450f10aa9914204b283eae5fadee2897d1911"
    },
    {
      "id": "rfc2119",
      "edition": "RFC 2119 published text; no implicit errata overlay",
      "uri": "https://www.rfc-editor.org/rfc/rfc2119.txt",
      "sha256": "3c2ceb7bfc84cd34720f4a5271338ab9d8280d34bdd1eb250c64306202f2ed8b"
    },
    {
      "id": "rfc3986",
      "edition": "RFC 3986 published text; no implicit errata overlay",
      "uri": "https://www.rfc-editor.org/rfc/rfc3986.txt",
      "sha256": "3102dae4b68cebe40337730312fcb612297b8928547267e8b3d1ee6002b2d683"
    },
    {
      "id": "rfc4648",
      "edition": "RFC 4648 published text; no implicit errata overlay",
      "uri": "https://www.rfc-editor.org/rfc/rfc4648.txt",
      "sha256": "84e14418f795d503be5f34bf23ce4ebaa119e9ec7c9f667d8caeb111385b178f"
    },
    {
      "id": "rfc6749",
      "edition": "RFC 6749 published text; no implicit errata overlay",
      "uri": "https://www.rfc-editor.org/rfc/rfc6749.txt",
      "sha256": "f204fc8661d6c92d2ec6e0b54808f961a9ad26e792f57f312d9528335519bd71"
    },
    {
      "id": "rfc6750",
      "edition": "RFC 6750 published text; no implicit errata overlay",
      "uri": "https://www.rfc-editor.org/rfc/rfc6750.txt",
      "sha256": "9dc385cf4ecdd85024e5a95e447ede9230e11700bf35251906b25b37557d604b"
    },
    {
      "id": "rfc6755",
      "edition": "RFC 6755 published text; no implicit errata overlay",
      "uri": "https://www.rfc-editor.org/rfc/rfc6755.txt",
      "sha256": "234e7af0f899d96ab67fc0284fd51aa1e52992f7e250225cbc6ad0cf9e2f16b1"
    },
    {
      "id": "rfc6819",
      "edition": "RFC 6819 published text; no implicit errata overlay",
      "uri": "https://www.rfc-editor.org/rfc/rfc6819.txt",
      "sha256": "7130b62c2861e8f8a7a28aa1af9d12b6dd49e9f1353f51a84314026fbcf9dd08"
    },
    {
      "id": "rfc7009",
      "edition": "RFC 7009 published text; no implicit errata overlay",
      "uri": "https://www.rfc-editor.org/rfc/rfc7009.txt",
      "sha256": "b2f346d5a87ba9d7f09047901257a65f7ac0b26352095969c25821afab447829"
    },
    {
      "id": "rfc7515",
      "edition": "RFC 7515 published text; no implicit errata overlay",
      "uri": "https://www.rfc-editor.org/rfc/rfc7515.txt",
      "sha256": "ecbf84674118e62526511c1237e1deaa86aada86d25b247623a2a7e04ae62e40"
    },
    {
      "id": "rfc7516",
      "edition": "RFC 7516 published text; no implicit errata overlay",
      "uri": "https://www.rfc-editor.org/rfc/rfc7516.txt",
      "sha256": "722cfcddc15f58e746891ba4b846853d3711153a774e4dd55ad6db100474a21f"
    },
    {
      "id": "rfc7517",
      "edition": "RFC 7517 published text; no implicit errata overlay",
      "uri": "https://www.rfc-editor.org/rfc/rfc7517.txt",
      "sha256": "681c19b92a85068716b7e89c5815aa821bd3f11c755ff1c641b40ae9851bb33c"
    },
    {
      "id": "rfc7518",
      "edition": "RFC 7518 published text; no implicit errata overlay",
      "uri": "https://www.rfc-editor.org/rfc/rfc7518.txt",
      "sha256": "9a9ae524b09ea700ad3f189bac115df95ba69af84b26ffdbe3cdfb8d2152b1fc"
    },
    {
      "id": "rfc7519",
      "edition": "RFC 7519 published text; no implicit errata overlay",
      "uri": "https://www.rfc-editor.org/rfc/rfc7519.txt",
      "sha256": "fecd930e9ccf2276b95c0017c6c4ff5d09352e4bc3c7629946447894e0f97248"
    },
    {
      "id": "rfc7521",
      "edition": "RFC 7521 published text; no implicit errata overlay",
      "uri": "https://www.rfc-editor.org/rfc/rfc7521.txt",
      "sha256": "d5d97b3e691c9bbc495c277cc2cd79316b82486991468fc346a96ab59ba4b3c8"
    },
    {
      "id": "rfc7522",
      "edition": "RFC 7522 published text; no implicit errata overlay",
      "uri": "https://www.rfc-editor.org/rfc/rfc7522.txt",
      "sha256": "87656a015c74b2cce4ed74fdf785ea2cf824e8d13cc53860d40fac3e57569afd"
    },
    {
      "id": "rfc7523",
      "edition": "RFC 7523 published text; no implicit errata overlay",
      "uri": "https://www.rfc-editor.org/rfc/rfc7523.txt",
      "sha256": "ae24f77a8fc4338903c805c6ace38def1f23d40194aea87b123b13c5b3d2d915"
    },
    {
      "id": "rfc7591",
      "edition": "RFC 7591 published text; no implicit errata overlay",
      "uri": "https://www.rfc-editor.org/rfc/rfc7591.txt",
      "sha256": "f9cd8b8eefdb2d1b1bd5734310f246926db0abb4ec1b2f933f358d58327964e3"
    },
    {
      "id": "rfc7592",
      "edition": "RFC 7592 published text; no implicit errata overlay",
      "uri": "https://www.rfc-editor.org/rfc/rfc7592.txt",
      "sha256": "6e59ce6f2f7cd98bfe849f643a55ddb45fc0278a43c49b2cf0d947ca604ccaee"
    },
    {
      "id": "rfc7636",
      "edition": "RFC 7636 published text; no implicit errata overlay",
      "uri": "https://www.rfc-editor.org/rfc/rfc7636.txt",
      "sha256": "1972e5d81cbaba7066cfd46374207bc2b4546b085ed5dd9b034e79e023e0ca31"
    },
    {
      "id": "rfc7638",
      "edition": "RFC 7638 published text; no implicit errata overlay",
      "uri": "https://www.rfc-editor.org/rfc/rfc7638.txt",
      "sha256": "98b29ab9652070e6a5fec748d43e221bbedc66b6b22e05903fb5366c04ef3110"
    },
    {
      "id": "rfc7662",
      "edition": "RFC 7662 published text; no implicit errata overlay",
      "uri": "https://www.rfc-editor.org/rfc/rfc7662.txt",
      "sha256": "2b7d688cb849f093e860557ac97e6cddac2556d69a4386561b22cdf97bf13657"
    },
    {
      "id": "rfc7800",
      "edition": "RFC 7800 published text; no implicit errata overlay",
      "uri": "https://www.rfc-editor.org/rfc/rfc7800.txt",
      "sha256": "051514a781038027c2ac07c26ebe8533556012b2353cdaec8f3baeac53a7c919"
    },
    {
      "id": "rfc8037",
      "edition": "RFC 8037 published text; no implicit errata overlay",
      "uri": "https://www.rfc-editor.org/rfc/rfc8037.txt",
      "sha256": "f14347f9d8eead78ef6e7a1ea3d795d35d664033095a76a80fcd567904aaedaa"
    },
    {